{"$schema":"https://json-schema.org/draft/2020-12/schema","title":"OfficialSourceManifest","type":"object","additionalProperties":false,"required":["manifest_id","version","scope","source_policy","sources"],"properties":{"manifest_id":{"type":"string","minLength":1},"version":{"type":"string","minLength":1},"scope":{"type":"string","minLength":1},"source_policy":{"type":"object","additionalProperties":false,"required":["upstream_source_of_truth","kernel_role","workbook_policy","project_availability_policy","runtime_policy"],"properties":{"upstream_source_of_truth":{"type":"string","minLength":1},"kernel_role":{"type":"string","minLength":1},"workbook_policy":{"type":"string","minLength":1},"project_availability_policy":{"type":"string","minLength":1},"runtime_policy":{"type":"string","minLength":1}}},"sources":{"type":"array","minItems":1,"items":{"type":"object","additionalProperties":false,"required":["source_id","title","url","source_class","authority","retrieved_or_verified_at","verification_method","claims","verification_scope","support_status","limitations","used_by"],"properties":{"source_id":{"type":"string","minLength":1},"title":{"type":"string","minLength":1},"url":{"type":"string","format":"uri"},"source_class":{"enum":["official_elementor_help","official_elementor_developer_docs","elementor_release_notes","mdn_reference","css_spec","workbook_derived","controlled_experiment","project_contract"]},"authority":{"enum":["official_upstream","standards_reference","derived_educational_seed","project_local","experiment_local"]},"retrieved_or_verified_at":{"type":"string","minLength":1},"verification_method":{"type":"string","minLength":1},"claims":{"type":"array","minItems":1,"items":{"type":"object","additionalProperties":false,"required":["claim_id","claim_type","claim","support_status"],"properties":{"claim_id":{"type":"string","minLength":1},"claim_type":{"enum":["platform_capability","developer_api_capability","editor_v4_ui","project_availability","constructability","builder_execution","responsive_runtime","production_readiness"]},"claim":{"type":"string","minLength":1},"support_status":{"enum":["supported","partially_supported","insufficient_evidence","proposed","contradicted","deprecated","version_sensitive"]}}}},"verification_scope":{"type":"array","minItems":1,"items":{"enum":["platform_capability","developer_api_capability","editor_v4_ui","project_availability","constructability","builder_execution","responsive_runtime","production_readiness"]}},"support_status":{"enum":["supported","partially_supported","insufficient_evidence","proposed","contradicted","deprecated","version_sensitive"]},"limitations":{"type":"array","items":{"type":"string","minLength":1},"minItems":1},"used_by":{"type":"array","items":{"type":"string","minLength":1},"minItems":1}}}}}}
