{"manifest_id":"fixture.official-source-manifest.valid","version":"0.3.0-source-cards","scope":"Valid source manifest fixture.","source_policy":{"upstream_source_of_truth":"Official Elementor docs remain upstream truth.","kernel_role":"Structured extraction only.","workbook_policy":"Workbook material is educational seed only.","project_availability_policy":"Project availability is not proven by docs.","runtime_policy":"Runtime proof is future evidence."},"sources":[{"source_id":"src.fixture.elementor.svg","title":"SVG element","url":"https://elementor.com/help/svg-element/","source_class":"official_elementor_help","authority":"official_upstream","retrieved_or_verified_at":"2026-07-08T00:00:00Z","verification_method":"web_open","claims":[{"claim_id":"claim.fixture.svg","claim_type":"editor_v4_ui","claim":"SVG source fixture claim.","support_status":"supported"}],"verification_scope":["editor_v4_ui"],"support_status":"supported","limitations":["No project availability or runtime proof."],"used_by":["v4.svg"]}]}
