{"manifest_id":"fixture.official-source-components.valid","version":"0.3.1-source-cards-repair","scope":"Valid Components source fixture without project availability claims.","source_policy":{"upstream_source_of_truth":"Official Elementor docs remain upstream truth.","kernel_role":"Structured extraction only.","workbook_policy":"Workbook material is educational seed only.","project_availability_policy":"Project availability is not proven by docs.","runtime_policy":"Runtime proof is future evidence."},"sources":[{"source_id":"src.fixture.elementor.components","title":"Components","url":"https://elementor.com/help/components-2/","source_class":"official_elementor_help","authority":"official_upstream","retrieved_or_verified_at":"2026-07-08T00:00:00Z","verification_method":"web_open","claims":[{"claim_id":"claim.fixture.components","claim_type":"editor_v4_ui","claim":"Components are documented as reusable design blocks with global sync and per-instance customization.","support_status":"supported"}],"verification_scope":["editor_v4_ui"],"support_status":"supported","limitations":["Requires Atomic elements, Admin-level permissions, and Elementor Pro.","Does not prove target project availability, current user permission, runtime behavior, Builder execution, or production readiness."],"used_by":["kernel/decision-cards/elements.core.v0.json"]}]}
